{
  "$schema": "http://json-schema.org/draft-07/schema#",
  "$id": "public_prose",
  "title": "PublicProseArtifact",
  "description": "Final reader-facing prose. Must be generated from prior artifacts, not directly from source material. Requires at least one extraction artifact and one validation artifact in input_artifact_ids before status can be reviewed or published. Stage G of the artifact pipeline.",
  "type": "object",
  "required": [
    "artifact_id",
    "artifact_type",
    "schema_version",
    "source_id",
    "generated_at",
    "input_artifact_ids",
    "title",
    "editorial_status"
  ],
  "additionalProperties": false,
  "properties": {
    "artifact_id":   { "type": "string", "minLength": 1 },
    "artifact_type": { "type": "string", "const": "public_prose" },
    "schema_version":{ "type": "string", "pattern": "^\\d+\\.\\d+$" },
    "source_id":     { "type": "string", "minLength": 1 },
    "generated_at":  { "type": "string", "format": "date-time" },
    "generated_by":  { "type": ["string", "null"] },
    "input_artifact_ids": {
      "type": "array",
      "minItems": 1,
      "items": { "type": "string" },
      "description": "Must include at least one raw_extraction and one validation artifact to reach reviewed/published status"
    },
    "title":             { "type": "string", "minLength": 1 },
    "dek":               { "type": ["string", "null"], "description": "Short description / subtitle for display" },
    "body_markdown":     { "type": ["string", "null"] },
    "summary":           { "type": ["string", "null"], "description": "1-3 sentence summary for aggregators or search results" },
    "tags":              { "type": "array", "items": { "type": "string" } },
    "citations_or_source_links": {
      "type": "array",
      "items": { "type": "string" }
    },
    "emergency_prototype_mode": {
      "type": "boolean",
      "description": "If true, this prose was generated directly from source material without prior artifacts. Explicitly mark only."
    },
    "editorial_status": {
      "type": "string",
      "enum": ["draft", "reviewed", "published", "deprecated"],
      "description": "reviewed/published require input_artifact_ids to include raw_extraction and validation"
    },
    "revision_notes": { "type": ["string", "null"] }
  }
}
